{
  "schema_version": "1.0",
  "description": "문서 ACL의 DENY 규칙이 일치하면 allowed=false 이지만 reason은 여전히 acl.matched_rule 이다 (규칙이 없어서가 아니라 규칙이 거부해서 막힘).",
  "input": {
    "permission": "delete",
    "subject_type": "user",
    "subject_id": "user-1",
    "namespace": "*",
    "document_acl": {
      "document_id": "fixture-doc",
      "rules": [
        {
          "id": "all-delete-deny",
          "subject_type": "all",
          "subject_id": null,
          "permission": "delete",
          "effect": "deny"
        }
      ]
    }
  },
  "expected": {
    "allowed": false,
    "reason": "acl.matched_rule",
    "matched_rule_id": "all-delete-deny"
  },
  "errors": []
}
